{
  "schemaVersion": "rcap-official-pdf-field-map/v1",
  "familyId": "rcap-ar-official-pdf-family",
  "jurisdiction": "AR",
  "activeMappingCount": 0,
  "activeOverlayPlacementCount": 0,
  "mappingPolicy": {
    "sourceOfFieldNames": "freshly_verified_captain_projected_exact_authority_bytes",
    "authorityAssetRequired": true,
    "captainAssignmentRequired": true,
    "portableProjectionRequired": true,
    "candidateEvidenceIsStructureEvidenceOnly": true,
    "historicalMeasurementsAreNotLocalVerification": true,
    "compositeVariantBindingRequired": true,
    "mixedFooterRevisionDecisionRequired": true,
    "unknownSemanticMatchesRemainUnmapped": true,
    "missingMappedFieldFails": "field_not_found",
    "unconfirmedOverlayFails": "mapping_unconfirmed",
    "thirdPartyFieldsRemainBlank": true,
    "signatureImagesGenerated": false,
    "activeMappingCountUntilAllGatesPass": 0
  },
  "forms": [
    {
      "officialFormId": "ACIC-ORDER-DISMISS-AND-SEAL-FIRST-OFFENDERS",
      "authorityState": "authority_unmanifested_source",
      "identityBindingStatus": "document_identity_known_exact_authority_asset_unresolved",
      "rendererStrategy": null,
      "mappingReady": false,
      "expectedStructure": null,
      "candidateEvidenceIds": [
        "acic-order-to-dismiss-and-seal-first-offenders-act-346-rev-2014-01-01"
      ],
      "usageBindings": [
        {
          "trackId": "ar-act346",
          "componentId": "ar-act346-proposed-order-3"
        }
      ],
      "mappings": [],
      "overlayPlacements": []
    },
    {
      "officialFormId": "ACIC-ORDER-DRUG-COURT",
      "authorityState": "authority_unmanifested_source",
      "identityBindingStatus": "document_identity_known_exact_authority_asset_unresolved",
      "rendererStrategy": null,
      "mappingReady": false,
      "expectedStructure": null,
      "candidateEvidenceIds": [
        "acic-order-to-dismiss-and-seal-pre-adjudication-drug-court-offense-rev-2014-01-01"
      ],
      "usageBindings": [
        {
          "trackId": "ar-drug-court",
          "componentId": "ar-drug-court-proposed-order-3"
        }
      ],
      "mappings": [],
      "overlayPlacements": []
    },
    {
      "officialFormId": "ACIC-ORDER-SEAL-ACT-531-ACT-1460",
      "authorityState": "authority_unmanifested_source",
      "identityBindingStatus": "document_identity_known_exact_authority_asset_unresolved",
      "rendererStrategy": null,
      "mappingReady": false,
      "expectedStructure": null,
      "candidateEvidenceIds": [
        "acic-order-to-seal-under-community-punishment-act-531-and-act-1460-rev-2014-08-25"
      ],
      "usageBindings": [
        {
          "trackId": "ar-act531",
          "componentId": "ar-act531-proposed-order-2"
        }
      ],
      "mappings": [],
      "overlayPlacements": []
    },
    {
      "officialFormId": "ACIC-ORDER-TO-SEAL-ARREST",
      "authorityState": "authority_unmanifested_source",
      "identityBindingStatus": "document_identity_known_exact_authority_asset_unresolved",
      "rendererStrategy": null,
      "mappingReady": false,
      "expectedStructure": null,
      "candidateEvidenceIds": [
        "acic-order-to-seal-arrest-under-act-1460-rev-2014-01-01"
      ],
      "usageBindings": [
        {
          "trackId": "ar-arrest-seal",
          "componentId": "ar-arrest-seal-proposed-order-2"
        }
      ],
      "mappings": [],
      "overlayPlacements": []
    },
    {
      "officialFormId": "ACIC-ORDER-TO-SEAL-CS-POSSESSION",
      "authorityState": "authority_unmanifested_source",
      "identityBindingStatus": "document_identity_known_exact_authority_asset_unresolved",
      "rendererStrategy": null,
      "mappingReady": false,
      "expectedStructure": null,
      "candidateEvidenceIds": [
        "acic-order-to-seal-controlled-or-counterfeit-substance-possession-conviction-rev-2014-01-0"
      ],
      "usageBindings": [
        {
          "trackId": "ar-cs-possession-seal",
          "componentId": "ar-cs-possession-seal-proposed-order-2"
        }
      ],
      "mappings": [],
      "overlayPlacements": []
    },
    {
      "officialFormId": "ACIC-ORDER-TO-SEAL-MISDEMEANOR-DWI-BWI",
      "authorityState": "authority_unmanifested_source",
      "identityBindingStatus": "document_identity_known_exact_authority_asset_unresolved",
      "rendererStrategy": null,
      "mappingReady": false,
      "expectedStructure": null,
      "candidateEvidenceIds": [
        "acic-order-to-seal-misdemeanor-dwi-or-bwi-conviction-rev-2021-07-27"
      ],
      "usageBindings": [
        {
          "trackId": "ar-misdemeanor-dwi-seal",
          "componentId": "ar-misdemeanor-dwi-seal-proposed-order-3"
        }
      ],
      "mappings": [],
      "overlayPlacements": []
    },
    {
      "officialFormId": "ACIC-ORDER-TO-SEAL-NONCONVICTION",
      "authorityState": "authority_unmanifested_source",
      "identityBindingStatus": "document_identity_known_exact_authority_asset_unresolved",
      "rendererStrategy": null,
      "mappingReady": false,
      "expectedStructure": null,
      "candidateEvidenceIds": [
        "acic-order-to-seal-nolle-prosequi-dismissal-acquittal-or-no-charge-records-rev-2023-10-25"
      ],
      "usageBindings": [
        {
          "trackId": "ar-nonconviction-seal",
          "componentId": "ar-nonconviction-seal-proposed-order-2"
        }
      ],
      "mappings": [],
      "overlayPlacements": []
    },
    {
      "officialFormId": "ACIC-ORDER-TO-SEAL-PARDONED-OFFENDER",
      "authorityState": "authority_unmanifested_source",
      "identityBindingStatus": "document_identity_known_exact_authority_asset_unresolved",
      "rendererStrategy": null,
      "mappingReady": false,
      "expectedStructure": null,
      "candidateEvidenceIds": [
        "acic-order-to-seal-records-of-pardoned-offender-or-youthful-felony-offender-rev-2022-03-07"
      ],
      "usageBindings": [
        {
          "trackId": "ar-pardon-seal",
          "componentId": "ar-pardon-seal-proposed-order-3"
        }
      ],
      "mappings": [],
      "overlayPlacements": []
    },
    {
      "officialFormId": "ACIC-ORDER-VETERANS-COURT",
      "authorityState": "authority_unmanifested_source",
      "identityBindingStatus": "document_identity_known_exact_authority_asset_unresolved",
      "rendererStrategy": null,
      "mappingReady": false,
      "expectedStructure": null,
      "candidateEvidenceIds": ["acquire:AR:acic-order-veterans-court"],
      "usageBindings": [
        {
          "trackId": "ar-veterans-court",
          "componentId": "ar-veterans-court-proposed-order-3"
        }
      ],
      "mappings": [],
      "overlayPlacements": []
    },
    {
      "officialFormId": "ACIC-PETITION-DISMISS-AND-SEAL-FIRST-OFFENDERS",
      "authorityState": "authority_unmanifested_source",
      "identityBindingStatus": "document_identity_known_exact_authority_asset_unresolved",
      "rendererStrategy": null,
      "mappingReady": false,
      "expectedStructure": null,
      "candidateEvidenceIds": [
        "acquire:AR:acic-petition-dismiss-and-seal-first-offenders"
      ],
      "usageBindings": [
        {
          "trackId": "ar-act346",
          "componentId": "ar-act346-primary-filing-2"
        }
      ],
      "mappings": [],
      "overlayPlacements": []
    },
    {
      "officialFormId": "ACIC-PETITION-DRUG-COURT",
      "authorityState": "authority_unmanifested_source",
      "identityBindingStatus": "document_identity_known_exact_authority_asset_unresolved",
      "rendererStrategy": null,
      "mappingReady": false,
      "expectedStructure": null,
      "candidateEvidenceIds": [
        "acic-petition-to-dismiss-and-seal-pre-adjudication-drug-court-offense-rev-2014-08-25"
      ],
      "usageBindings": [
        {
          "trackId": "ar-drug-court",
          "componentId": "ar-drug-court-primary-filing-2"
        }
      ],
      "mappings": [],
      "overlayPlacements": []
    },
    {
      "officialFormId": "ACIC-PETITION-SEAL-ACT-531-ACT-1460",
      "authorityState": "authority_unmanifested_source",
      "identityBindingStatus": "document_identity_known_exact_authority_asset_unresolved",
      "rendererStrategy": null,
      "mappingReady": false,
      "expectedStructure": null,
      "candidateEvidenceIds": [
        "acic-petition-to-seal-under-community-punishment-act-531-and-act-1460-rev-2014-08-25"
      ],
      "usageBindings": [
        {
          "trackId": "ar-act531",
          "componentId": "ar-act531-primary-filing-1"
        }
      ],
      "mappings": [],
      "overlayPlacements": []
    },
    {
      "officialFormId": "ACIC-PETITION-TO-SEAL-ARREST",
      "authorityState": "authority_unmanifested_source",
      "identityBindingStatus": "document_identity_known_exact_authority_asset_unresolved",
      "rendererStrategy": null,
      "mappingReady": false,
      "expectedStructure": null,
      "candidateEvidenceIds": [
        "acic-petition-to-seal-arrest-under-act-1460-rev-2014-08-25"
      ],
      "usageBindings": [
        {
          "trackId": "ar-arrest-seal",
          "componentId": "ar-arrest-seal-primary-filing-1"
        }
      ],
      "mappings": [],
      "overlayPlacements": []
    },
    {
      "officialFormId": "ACIC-PETITION-TO-SEAL-CS-POSSESSION",
      "authorityState": "authority_unmanifested_source",
      "identityBindingStatus": "document_identity_known_exact_authority_asset_unresolved",
      "rendererStrategy": null,
      "mappingReady": false,
      "expectedStructure": null,
      "candidateEvidenceIds": [
        "acic-petition-to-seal-controlled-or-counterfeit-substance-possession-conviction-rev-2015-0"
      ],
      "usageBindings": [
        {
          "trackId": "ar-cs-possession-seal",
          "componentId": "ar-cs-possession-seal-primary-filing-1"
        }
      ],
      "mappings": [],
      "overlayPlacements": []
    },
    {